<!ELEMENT menu (item+)>
<!ELEMENT item (name, description, price, image, category, tag)>
<!ATTLIST item id CDATA #REQUIRED>

<!ELEMENT name (#PCDATA)>
<!ELEMENT description (#PCDATA)>
<!ELEMENT price (#PCDATA)>
<!ELEMENT image (#PCDATA)>
<!ELEMENT category (#PCDATA)>
<!ELEMENT tag (#PCDATA)>